{
  "$schema": "https://json-schema.org/draft/2020-12/schema",
  "$id": "golden_set.schema.json",
  "title": "ELS Detector Golden Set",
  "description": "Per-state golden set used by evaluation/eval_suite.py to grade the detector. Each file is a hand-annotated picture of what the detector SHOULD produce for one source document.",
  "type": "object",
  "required": [
    "state",
    "country",
    "version_year",
    "elements",
    "regression_cases"
  ],
  "properties": {
    "state": {
      "type": "string",
      "minLength": 2,
      "maxLength": 2
    },
    "country": {
      "type": "string",
      "minLength": 2,
      "maxLength": 2
    },
    "version_year": {
      "type": "integer"
    },
    "source_document": {
      "type": "string"
    },
    "annotator": {
      "type": "string"
    },
    "annotation_date": {
      "type": "string",
      "description": "YYYY-MM-DD"
    },
    "notes": {
      "type": "string",
      "description": "Free-form context for annotators / future readers."
    },
    "expected_depth_map": {
      "type": "object",
      "description": "What infer_depth_map SHOULD return for this document. Used to grade Pass-1.",
      "required": [
        "doc_depths"
      ],
      "properties": {
        "doc_depths": {
          "type": "array",
          "items": {
            "type": "object",
            "required": [
              "depth",
              "canonical_level"
            ],
            "properties": {
              "depth": {
                "type": "integer",
                "minimum": 1
              },
              "canonical_level": {
                "enum": [
                  "domain",
                  "strand",
                  "sub_strand",
                  "indicator"
                ]
              },
              "label_in_doc": {
                "type": "string"
              },
              "prefix_pattern": {
                "type": "string"
              },
              "example": {
                "type": "string"
              }
            }
          }
        }
      }
    },
    "elements": {
      "type": "array",
      "description": "Hand-annotated structural elements. Use as many as needed to cover the document; even a few-dozen-per-state is enough to detect regressions.",
      "items": {
        "type": "object",
        "required": [
          "test_case_id",
          "level",
          "title"
        ],
        "properties": {
          "test_case_id": {
            "type": "string",
            "description": "Stable identifier, e.g. CA-IND-01-EARLY. Used so failure messages reference a specific row."
          },
          "level": {
            "enum": [
              "domain",
              "strand",
              "sub_strand",
              "indicator"
            ]
          },
          "code": {
            "type": [
              "string",
              "null"
            ],
            "description": "The DOCUMENT-LOCAL code the detector emits (e.g. domain 'ATL', strand '1.0', indicator '1.1'). NOT the full dotted parser code. Detector matching is code-agnostic (title + age_band + domain), so this is informational; null is fine where the document has no code."
          },
          "title": {
            "type": "string"
          },
          "description": {
            "type": [
              "string",
              "null"
            ]
          },
          "age_band": {
            "type": [
              "string",
              "null"
            ],
            "description": "Required for indicators that come from age-band columns; null otherwise."
          },
          "source_page": {
            "type": [
              "integer",
              "string"
            ],
            "description": "Page number, or 'TODO' while annotating."
          },
          "parser_expected": {
            "type": "object",
            "description": "Authoritative expected PARSER output for this element (only meaningful on indicators). The detector never produces these; parentage, full hierarchical codes, month-normalized age bands, and standard_id assembly are parser.py's job. Populated from a human-verified parser run (see evaluation/_bootstrap_parser_expected.py) and graded for exact equality by eval_parser.py. The detector grader ignores this block.",
            "properties": {
              "domain_code": { "type": ["string", "null"] },
              "domain_name": { "type": ["string", "null"] },
              "strand_code": { "type": ["string", "null"] },
              "strand_name": { "type": ["string", "null"] },
              "sub_strand_code": { "type": ["string", "null"] },
              "sub_strand_name": { "type": ["string", "null"] },
              "indicator_code": { "type": ["string", "null"] },
              "indicator_name": { "type": ["string", "null"] },
              "age_band_months": {
                "type": ["string", "null"],
                "description": "Parser's month-normalized age band, e.g. '36-54' (Early), '36-66' (Later), '36-48' (PK3), '48-60' (PK4). Null when the indicator carries no age band."
              },
              "standard_id": {
                "type": ["string", "null"],
                "description": "Expected deterministic id: COUNTRY-STATE-YEAR-DOMAINCODE-INDICATORCODE[-AGEBANDMONTHS]."
              }
            }
          }
        }
      }
    },
    "regression_cases": {
      "type": "array",
      "description": "Behavioural assertions targeted at known failure modes. Each case is checked against live pipeline output and reported pass/fail: eval_detector.py runs cases via regression_checks.lookup (check_<id>), eval_parser.py via regression_checks.lookup_parser (check_parser_<id>); a case with no function for a stage is SKIPped. Keep them assertion-style.",
      "items": {
        "type": "object",
        "required": [
          "id",
          "description",
          "assertion"
        ],
        "properties": {
          "id": {
            "type": "string",
            "description": "e.g. CA-AGE-COLUMNS-EMITTED"
          },
          "description": {
            "type": "string",
            "description": "Human-readable reason for this case (links to a real bug if applicable)."
          },
          "assertion": {
            "type": "string",
            "description": "Plain-English assertion. The matching check function lives in evaluation/regression_checks.py keyed by id."
          }
        }
      }
    }
  }
}