{
  "$schema": "../golden_set.schema.json",
  "state": "TX",
  "country": "US",
  "version_year": 2022,
  "source_document": "Texas 2022 Prekindergarten Guidelines.pdf",
  "annotator": "TODO",
  "annotation_date": "TODO",
  "notes": "TX uses a 4-level hierarchy: Domain (Roman numeral) → Strand (letter) → Sub-Strand (numeric) → Indicator. Indicators come in side-by-side PK3/PK4 columns — each column is a SEPARATE indicator with its own code (e.g. PK3.I.A.2 vs PK4.I.A.2).",
  "expected_depth_map": {
    "doc_depths": [
      {
        "depth": 1,
        "canonical_level": "domain",
        "label_in_doc": "Domain",
        "prefix_pattern": "Roman.<Title>",
        "example": "I. Social and Emotional Development"
      },
      {
        "depth": 2,
        "canonical_level": "strand",
        "label_in_doc": "Skill area",
        "prefix_pattern": "I.A. <Title>",
        "example": "I.A. Self-Concept"
      },
      {
        "depth": 3,
        "canonical_level": "sub_strand",
        "label_in_doc": "Skill",
        "prefix_pattern": "I.A.<n> <Title>",
        "example": "I.B.1 Behavior Control"
      },
      {
        "depth": 4,
        "canonical_level": "indicator",
        "label_in_doc": "Outcome",
        "prefix_pattern": "PK[34].I.A.<n> <Outcome text>",
        "example": "PK3.I.A.2 Child can identify own physical attributes ..."
      }
    ]
  },
  "elements": [
    {
      "test_case_id": "TX-DOM-01",
      "level": "domain",
      "code": "I",
      "title": "Social and Emotional Development Domain",
      "description": "While a prekindergarten education should include activities that strengthen cognitive skills, it must also provide for the development of the social and emotional competencies required for school readiness and success in life. The development of these personal and social skills enables children to build a sense of who they are and what they can do. Supportive, positive relationships between teachers and children are essential to implementing effective practices that support a child’s social and emotional development. Children must establish positive relationships with adults and peers to participate effectively in the classroom community, assert independence in appropriate ways, and accomplish tasks that are meaningful to them without infringing on the rights of others. Children who can follow directions, communicate their wants, and needs effectively, and get along with other children are better prepared for kindergarten and beyond. Early experiences influence brain development by establishing the neural connections that provide the foundation for language, reasoning, problem solving, social skills, behavior, and emotional health. Daily experiences such as transitioning from home to school, sharing a space or materials, resolving conflicts, and demonstrating empathy contribute to a child’s social and emotional development. However, children benefit from direct instruction and repeated opportunities to practice these skills. The Social and Emotional Development Domain of the Texas Prekindergarten Guidelines is divided into the following skills: self-concept, self-regulation, relationships with others, and social awareness.",
      "source_page": 4,
      "parent_code": null
    },
    {
      "test_case_id": "TX-STR-01",
      "level": "strand",
      "code": "I.A",
      "title": "Self-Concept",
      "description": "Central to understanding emotional development is the idea of self-concept: an ever-increasing level of conscious awareness of one’s feelings, thoughts, abilities, likes, and dislikes, as well as awareness of one’s body in space. Prekindergarten children’s emerging ability to perceive these aspects of themselves at a conscious level distinguishes them from toddlers, who lack such awareness. Children begin to generate multiple answers to the question “Who am I?” which is an essential aspect of becoming competent in related areas, such as self-control and social/friendship skills. A child’s identity includes cultural and linguistic factors, and the prekindergarten environment is one of the first public opportunities for children to recognize the uniqueness of their own home culture and language as well as accept and value cultures and languages different from their own. Early childhood educators must model the mindset of diversity as an asset in the classroom, school, and community.",
      "source_page": 4,
      "parent_code": "I"
    },
    {
      "test_case_id": "TX-IND-01-PK3",
      "level": "indicator",
      "code": "PK3.I.A.2",
      "title": "Child can identify own physical attributes and indicate some likes and dislikes when prompted.",
      "age_band": "PK3",
      "description": null,
      "source_page": 4,
      "parent_code": "I.A",
      "domain_code": "I",
      "strand_code": "I.A",
      "sub_strand_code": null
    },
    {
      "test_case_id": "TX-IND-01-PK4",
      "level": "indicator",
      "code": "PK4.I.A.2",
      "title": "Child shows self-awareness of physical attributes, personal preferences, and own abilities.",
      "age_band": "PK4",
      "description": null,
      "source_page": 4,
      "parent_code": "I.A",
      "domain_code": "I",
      "strand_code": "I.A",
      "sub_strand_code": null
    },
    {
      "test_case_id": "TX-STR-02",
      "level": "strand",
      "code": "I.B",
      "title": "Self-Regulation",
      "description": "Prekindergarten children feel safer and function more successfully in the classroom when rules and routines are consistently implemented. A well-organized classroom with well-prepared activities helps children expand their attention span and build self-control and personal responsibility. As they encounter and overcome new and various social obstacles when interacting with peers, guidance from teachers will enable them to learn acceptable ways of dealing with social and emotional stress and/or excitement. Self-regulation skills include three subskills: behavior control, emotional control, and control of attention. Subskills only appear in this section of the Texas Prekindergarten Guidelines and are represented by a lowercase letter at the end of the citation.",
      "source_page": 6,
      "parent_code": "I"
    },
    {
      "test_case_id": "TX-SUB-01",
      "level": "sub_strand",
      "code": "I.B.2",
      "title": "Emotional Control",
      "description": null,
      "source_page": 7,
      "parent_code": "I.B"
    },
    {
      "test_case_id": "TX-IND-02-PK3",
      "level": "indicator",
      "code": "PK3.I.B.2.b",
      "title": "Child is familiar with basic feeling words (e.g., happy, sad, mad, scared).",
      "age_band": "PK3",
      "description": null,
      "source_page": 7,
      "parent_code": "I.B.2",
      "domain_code": "I",
      "strand_code": "I.B",
      "sub_strand_code": "I.B.2"
    },
    {
      "test_case_id": "TX-IND-02-PK4",
      "level": "indicator",
      "code": "PK4.I.B.2.b",
      "title": "Child uses verbal and nonverbal communication to communicate basic emotions and feelings.",
      "age_band": "PK4",
      "description": null,
      "source_page": 7,
      "parent_code": "I.B.2",
      "domain_code": "I",
      "strand_code": "I.B",
      "sub_strand_code": "I.B.2"
    }
  ],
  "regression_cases": [
    {
      "id": "TX-PK3-PK4-DISTINCT",
      "description": "PK3 and PK4 outcomes for the same skill row must each emit their own indicator.",
      "assertion": "for every skill row, the detected output contains at least one indicator with code starting 'PK3.' AND at least one with code starting 'PK4.'."
    },
    {
      "id": "TX-AGE-BAND-SET",
      "description": "Age band must be populated for every indicator.",
      "assertion": "every indicator has age_band in {'PK3', 'PK4'}."
    },
    {
      "id": "TX-NO-COLUMN-HEADER-AS-INDICATOR",
      "description": "The literal text 'PK3 Outcome' / 'PK4 Outcome' column headers must not be extracted as indicators.",
      "assertion": "no indicator has title in {'PK3 Outcome', 'PK4 Outcome', 'PK3', 'PK4'}."
    }
  ]
}