{
  "$schema": "../golden_set.schema.json",
  "state": "AZ",
  "country": "US",
  "version_year": 2018,
  "source_document": "Arizona Early Learning Standards",
  "annotator": "Emily Cheyne",
  "annotation_date": "05-25-2026",
  "notes": "AZ uses 'Standard → Strand → Concept → Indicator'. Map Standard → domain, Strand → strand, Concept → sub_strand, Indicator (the learning-goal sentence, NOT the lettered 'a./b./c.' examples beneath it) → indicator. No age-band columns.",
  "expected_depth_map": {
    "doc_depths": [
      {
        "depth": 1,
        "canonical_level": "domain",
        "label_in_doc": "Standard",
        "prefix_pattern": "ALL-CAPS STANDARD NAME",
        "example": "SOCIAL EMOTIONAL DEVELOPMENT STANDARD"
      },
      {
        "depth": 2,
        "canonical_level": "strand",
        "label_in_doc": "Strand",
        "prefix_pattern": "Strand N: <Title>",
        "example": "Strand 1: Self-Awareness and Emotional Skills"
      },
      {
        "depth": 3,
        "canonical_level": "sub_strand",
        "label_in_doc": "Concept",
        "prefix_pattern": "Concept N: <Title>",
        "example": "Concept 1: Self-Awareness"
      },
      {
        "depth": 4,
        "canonical_level": "indicator",
        "label_in_doc": "Indicator",
        "prefix_pattern": "<Learning-goal sentence ending in .>",
        "example": "The child demonstrates an awareness of self."
      }
    ]
  },
  "elements": [
    {
      "test_case_id": "AZ-DOM-SED",
      "level": "domain",
      "code": null,
      "title": "SOCIAL EMOTIONAL DEVELOPMENT STANDARD",
      "description": "Social emotional development is the core of early care and education because it sets a firm foundation on which all other learning will take place. Children’s emotional development is built into the architecture of their brains. Relationships that provide social, emotional, and physical security promote and enhance a child’s ability to learn and thrive. To grow socially and emotionally, children need to develop an increasing capacity to experience, express, and gain self-control over their emotions and social interactions. This development is enhanced by nurturing relationships and positive early learning experiences. A consistent, predictable, and engaging environment strengthens a child’s confidence in approaching new challenges, interacting with others, and exploring their environment. Established social-emotional skills have a significant, positive impact on a child’s learning, particularly in cognitive development. It sets the foundation for life-long success. This Standard articulates the ways in which a child can demonstrate their understanding of themselves and others, form positive social relationships, and relate to the world at large. Well-developed, strong, social emotional skills are critical when a child encounters a stressful life challenge. These hardships may include neglect, trauma, poverty, cultural and language differences, bias, and disabilities.",
      "source_page": 4
    },
    {
      "test_case_id": "AZ-STR-SE-1",
      "level": "strand",
      "code": "Strand 1",
      "title": "Self-Awareness and Emotional Skills",
      "description": null,
      "source_page": 5
    },
    {
      "test_case_id": "AZ-SUB-SE-1-1",
      "level": "sub_strand",
      "code": "Concept 2",
      "title": "Recognizes and Expresses Feelings",
      "description": "The child recognizes and expresses feelings of self and others. Children develop emotional literacy through the ability to identify and acknowledge their feelings and feelings of others through daily interactions.",
      "source_page": 5
    },
    {
      "test_case_id": "AZ-IND-SE-1-1-a",
      "level": "indicator",
      "code": "a",
      "title": "Associates emotions with words, facial expressions, and body language.",
      "description": "Describes the emotions of a character in a book. Signs, “I am mad” when asked how they feel.",
      "source_page": 5
    },
    {
      "test_case_id": "AZ-IND-SE-1-1-b",
      "level": "indicator",
      "code": "b",
      "title": "Identifies, describes, and expresses their own feelings.",
      "description": "Covers their eyes and says, \"This is scary!\" while listening to a story. Says, \"I am happy today because it's my birthday!\"",
      "source_page": 5
    }
  ],
  "regression_cases": [
    {
      "id": "AZ-NO-EXAMPLES-HEADER-AS-ELEMENT",
      "description": "Section headers like 'Indicators and Examples in the Context of Daily Routines, Activities, and Play' must not be emitted as structural elements.",
      "assertion": "no detected element has title containing 'Indicators and Examples in the Context'."
    },
    {
      "id": "AZ-FOUR-LEVEL-HIERARCHY",
      "description": "AZ uses all four levels.",
      "assertion": "the set of distinct levels in the detected output equals {'domain','strand','sub_strand','indicator'}."
    }
  ]
}
